,Shop,URL
0,登山・クライミング・アウトドア用品の総合専門店 好日山荘,https://www.kojitusanso.jp
1,登山とハイキング専門の旅行会社 山旅人yamatabito.com,https://yamatabito.com
2,登山ツアー企画の会社・企業一覧（全国） - Baseconnectbaseconnect.in  登山ツアー企画,https://baseconnect.in/companies/keyword/4405c087-2000-4d52-84f1-4e1ecd774fab&sa=U&ved=2ahUKEwiNiYjHm8n7AhXjBjQIHaSvBxYQFnoECAsQAg&usg=AOvVaw1abkEyVgop9auXtSnosUS2
3,石井スポ−ツ 公式サイト｜登山・スキー・アウトドア用品専門店,https://www.ici-sports.com
4,山幸｜登山用品・ハイキング・トレッキングシューズの登山専門店,http://www.yamakoh1964.co.jp
5,登山靴のキャラバン公式サイト  株式会社キャラバン,https://www.caravan-web.com
6,登山ツアーのアルプスエンタープライズ,https://www.alps-enterprise.co.jp
7,登山ツアー専門サイト 山日和,http://www.yamabiyori.jp
8,登山ツアー 山登りツアー 登山旅行 | 旅の本棚 東京・大阪・福岡 ...tabihon.jp,https://tabihon.jp
9,アウトドア＆登山専門店 シェルパrenzan.net,https://renzan.net
10,アルパインツアー・海外国内のハイキング、トレッキング、登山 ...,http://www.alpine-tour.com
